<?xml version="1.0" encoding="UTF-8"?>
<xs:schema xmlns:xs="http://www.w3.org/2001/XMLSchema">
    <xs:element name="customer">
        <xs:complexType>
            <xs:sequence>
                <xs:element name="name" type="xs:string"></xs:element>
                <xs:element name="email" type="xs:string"></xs:element>
                <xs:element name="registrationDate" type="xs:dateTime"></xs:element>
                <xs:element name="privileged" type="xs:boolean"></xs:element>
                <xs:element name="address">
                    <xs:complexType>
                        <xs:sequence>
                            <xs:element name="country" type="xs:string"/>
                            <xs:element name="city" type="xs:string" />
                            <xs:element name="streetLine" type="xs:string"/>
                            <xs:element name="postCode" type="xs:string"/>
                        </xs:sequence>     
                    </xs:complexType>
                </xs:element>
            </xs:sequence>
        </xs:complexType>
    </xs:element>
</xs:schema>